{
  "id": "route_2026_07_03_5ea76753a506",
  "rawArtifactId": "raw_2026_07_03_static_cninfo_com_cn_0cb904a4cc",
  "type": "filing",
  "entity": "紫金矿业",
  "entityId": "zijin_mining",
  "entityIds": [
    "zijin_mining"
  ],
  "pipeline": "filing_pipeline",
  "confidence": "high",
  "reason": "Artifact looks like a formal filing or exchange announcement.",
  "matchedSignals": [
    {
      "field": "artifact",
      "value": "filing",
      "reason": "filing artifact or disclosure keyword"
    }
  ],
  "sourceKind": "filing",
  "status": "routed",
  "createdAt": "2026-07-23T09:31:19+08:00",
  "nextAction": "run filing_pipeline",
  "notes": "Generated by route_artifact v1 rules."
}
