{
  "id": "route_2026_08_27_fdec70095f73",
  "rawArtifactId": "raw_2026_08_27_static_cninfo_com_cn_7a8d474abf",
  "type": "filing",
  "entity": "绿的谐波",
  "entityId": "leaderdrive",
  "entityIds": [
    "leaderdrive"
  ],
  "pipeline": "filing_pipeline",
  "confidence": "high",
  "reason": "Artifact looks like a formal filing or exchange announcement.",
  "matchedSignals": [
    {
      "field": "artifact",
      "value": "filing",
      "reason": "filing artifact or disclosure keyword"
    }
  ],
  "sourceKind": "filing",
  "status": "routed",
  "createdAt": "2026-08-27T16:32:40+08:00",
  "nextAction": "run filing_pipeline",
  "notes": "Generated by route_artifact v1 rules."
}
