{
  "id": "route_2026_07_22_ebcd3168a23e",
  "rawArtifactId": "raw_2026_07_22_static_cninfo_com_cn_835abdfdd3",
  "type": "filing",
  "entity": "北方华创",
  "entityId": "naura",
  "entityIds": [
    "naura"
  ],
  "pipeline": "filing_pipeline",
  "confidence": "high",
  "reason": "Artifact looks like a formal filing or exchange announcement.",
  "matchedSignals": [
    {
      "field": "artifact",
      "value": "filing",
      "reason": "filing artifact or disclosure keyword"
    }
  ],
  "sourceKind": "filing",
  "status": "routed",
  "createdAt": "2026-07-23T09:31:19+08:00",
  "nextAction": "run filing_pipeline",
  "notes": "Generated by route_artifact v1 rules."
}
