{
  "id": "route_2026_08_03_93355f51265d",
  "rawArtifactId": "raw_2026_08_03_static_cninfo_com_cn_912cf09672",
  "type": "filing",
  "entity": "汇川技术",
  "entityId": "inovance",
  "entityIds": [
    "inovance"
  ],
  "pipeline": "filing_pipeline",
  "confidence": "high",
  "reason": "Artifact looks like a formal filing or exchange announcement.",
  "matchedSignals": [
    {
      "field": "artifact",
      "value": "filing",
      "reason": "filing artifact or disclosure keyword"
    }
  ],
  "sourceKind": "filing",
  "status": "routed",
  "createdAt": "2026-08-03T21:13:35+08:00",
  "nextAction": "run filing_pipeline",
  "notes": "Generated by route_artifact v1 rules."
}
