{
  "id": "route_2026_06_01_4dab97f130b8",
  "rawArtifactId": "raw_2026_06_01_unitree_com_1b70ceffc7",
  "type": "product",
  "entity": "宇树科技",
  "entityId": "unitree",
  "entityIds": [
    "unitree"
  ],
  "pipeline": "product_pipeline",
  "confidence": "medium",
  "reason": "Artifact contains product page or launch/specification signals.",
  "matchedSignals": [
    {
      "field": "artifact/title",
      "value": "news_page 宇树科技发布 H2 Plus：专为学术研究打造的NVIDIA Isaac GR00T标杆人形机器人",
      "reason": "product release/spec signal"
    }
  ],
  "sourceKind": "official",
  "status": "routed",
  "createdAt": "2026-07-06T12:02:00+08:00",
  "nextAction": "run product_pipeline",
  "notes": "Generated by route_artifact v1 rules."
}
