{
  "id": "route_2026_06_13_e0e2551c9dca",
  "rawArtifactId": "raw_2026_06_13_static_cninfo_com_cn_451d5a6b62",
  "type": "filing",
  "entity": "概伦电子",
  "entityId": "primarius",
  "entityIds": [
    "primarius"
  ],
  "pipeline": "filing_pipeline",
  "confidence": "high",
  "reason": "Artifact looks like a formal filing or exchange announcement.",
  "matchedSignals": [
    {
      "field": "artifact",
      "value": "filing",
      "reason": "filing artifact or disclosure keyword"
    }
  ],
  "sourceKind": "filing",
  "status": "routed",
  "createdAt": "2026-07-23T09:50:52+08:00",
  "nextAction": "run filing_pipeline",
  "notes": "Generated by route_artifact v1 rules."
}
