{
  "id": "route_2026_07_02_8ee3d4830f82",
  "rawArtifactId": "raw_2026_07_02_static_cninfo_com_cn_867320ba7b",
  "type": "filing",
  "entity": "三峡水利",
  "entityId": "three_gorges_water",
  "entityIds": [
    "three_gorges_water"
  ],
  "pipeline": "filing_pipeline",
  "confidence": "high",
  "reason": "Artifact looks like a formal filing or exchange announcement.",
  "matchedSignals": [
    {
      "field": "artifact",
      "value": "filing",
      "reason": "filing artifact or disclosure keyword"
    }
  ],
  "sourceKind": "filing",
  "status": "routed",
  "createdAt": "2026-07-23T09:31:19+08:00",
  "nextAction": "run filing_pipeline",
  "notes": "Generated by route_artifact v1 rules."
}
