{
  "id": "route_2026_08_05_554b308a1d55",
  "rawArtifactId": "raw_2026_08_05_static_cninfo_com_cn_b2ebe374bd",
  "type": "filing",
  "entity": "中国石化",
  "entityId": "sinopec",
  "entityIds": [
    "sinopec"
  ],
  "pipeline": "filing_pipeline",
  "confidence": "high",
  "reason": "Artifact looks like a formal filing or exchange announcement.",
  "matchedSignals": [
    {
      "field": "artifact",
      "value": "filing",
      "reason": "filing artifact or disclosure keyword"
    }
  ],
  "sourceKind": "filing",
  "status": "routed",
  "createdAt": "2026-08-05T16:16:18+08:00",
  "nextAction": "run filing_pipeline",
  "notes": "Generated by route_artifact v1 rules."
}
