{
  "id": "route_2026_07_29_055988dfe50d",
  "rawArtifactId": "raw_2026_07_29_static_cninfo_com_cn_4b8f50c2ed",
  "type": "filing",
  "entity": "中国海油",
  "entityId": "cnooc",
  "entityIds": [
    "cnooc"
  ],
  "pipeline": "filing_pipeline",
  "confidence": "high",
  "reason": "Artifact looks like a formal filing or exchange announcement.",
  "matchedSignals": [
    {
      "field": "artifact",
      "value": "filing",
      "reason": "filing artifact or disclosure keyword"
    }
  ],
  "sourceKind": "filing",
  "status": "routed",
  "createdAt": "2026-07-29T16:16:17+08:00",
  "nextAction": "run filing_pipeline",
  "notes": "Generated by route_artifact v1 rules."
}
