{
  "id": "route_2026_07_28_8d0f5ae0af36",
  "rawArtifactId": "raw_2026_07_28_static_cninfo_com_cn_5cfa7b5fc8",
  "type": "filing",
  "entity": "兴业银锡",
  "entityId": "xingye_silver",
  "entityIds": [
    "xingye_silver"
  ],
  "pipeline": "filing_pipeline",
  "confidence": "high",
  "reason": "Artifact looks like a formal filing or exchange announcement.",
  "matchedSignals": [
    {
      "field": "artifact",
      "value": "filing",
      "reason": "filing artifact or disclosure keyword"
    }
  ],
  "sourceKind": "filing",
  "status": "routed",
  "createdAt": "2026-07-28T16:16:24+08:00",
  "nextAction": "run filing_pipeline",
  "notes": "Generated by route_artifact v1 rules."
}
