{
  "id": "route_2026_07_03_477ad436d051",
  "rawArtifactId": "raw_2026_07_03_static_cninfo_com_cn_99c75964ef",
  "type": "filing",
  "entity": "安集科技",
  "entityId": "anji_microelectronics",
  "entityIds": [
    "anji_microelectronics"
  ],
  "pipeline": "filing_pipeline",
  "confidence": "high",
  "reason": "Artifact looks like a formal filing or exchange announcement.",
  "matchedSignals": [
    {
      "field": "artifact",
      "value": "filing",
      "reason": "filing artifact or disclosure keyword"
    }
  ],
  "sourceKind": "filing",
  "status": "routed",
  "createdAt": "2026-07-23T09:50:52+08:00",
  "nextAction": "run filing_pipeline",
  "notes": "Generated by route_artifact v1 rules."
}
