{
  "id": "route_2026_08_24_25a8786f14ac",
  "rawArtifactId": "raw_2026_08_24_static_cninfo_com_cn_dbcb5c5fdb",
  "type": "filing",
  "entity": "东华测试",
  "entityId": "donghua_testing",
  "entityIds": [
    "donghua_testing"
  ],
  "pipeline": "filing_pipeline",
  "confidence": "high",
  "reason": "Artifact looks like a formal filing or exchange announcement.",
  "matchedSignals": [
    {
      "field": "artifact",
      "value": "filing",
      "reason": "filing artifact or disclosure keyword"
    }
  ],
  "sourceKind": "filing",
  "status": "routed",
  "createdAt": "2026-08-24T16:15:57+08:00",
  "nextAction": "run filing_pipeline",
  "notes": "Generated by route_artifact v1 rules."
}
