{
  "id": "route_2026_05_23_210711345684",
  "rawArtifactId": "raw_2026_05_23_static_cninfo_com_cn_1159392e6f",
  "type": "filing",
  "entity": "海南海药",
  "entityId": "hainan_haiyao",
  "entityIds": [
    "hainan_haiyao"
  ],
  "pipeline": "filing_pipeline",
  "confidence": "high",
  "reason": "Artifact looks like a formal filing or exchange announcement.",
  "matchedSignals": [
    {
      "field": "artifact",
      "value": "filing",
      "reason": "filing artifact or disclosure keyword"
    }
  ],
  "sourceKind": "filing",
  "status": "routed",
  "createdAt": "2026-07-23T09:50:52+08:00",
  "nextAction": "run filing_pipeline",
  "notes": "Generated by route_artifact v1 rules."
}
