{
  "id": "route_2026_03_28_23c1ef38b067",
  "rawArtifactId": "raw_2026_03_28_static_cninfo_com_cn_9a8ecd2061",
  "type": "filing",
  "entity": "中航光电",
  "entityId": "avic_jonhon",
  "entityIds": [
    "avic_jonhon"
  ],
  "pipeline": "filing_pipeline",
  "confidence": "high",
  "reason": "Artifact looks like a formal filing or exchange announcement.",
  "matchedSignals": [
    {
      "field": "artifact",
      "value": "filing",
      "reason": "filing artifact or disclosure keyword"
    }
  ],
  "sourceKind": "filing",
  "status": "routed",
  "createdAt": "2026-07-23T09:50:52+08:00",
  "nextAction": "run filing_pipeline",
  "notes": "Generated by route_artifact v1 rules."
}
